<aa xmlns="aa"
    xmlns:xsi="http://www.w3.org/2001/XMLSchema-instance"
    xsi:schemaLocation="aa validation/aa.xsd">
    <ipc>
        <type>MQUEUE</type>
        <compression>
            <enable>false</enable>
            <algo>zlib</algo>
            <args>
                <level>9</level>
            </args>
            <order>4</order>
        </compression>
        <encryption>
            <enable>false</enable>
            <algo>unknown</algo>
            <args>
            </args>
            <order>2</order>
        </encryption>
    </ipc>
</aa>
